{
    "$schema": "http:\/\/json-schema.org\/draft-07\/schema#",
    "type": "object",
    "properties": {
        "event_id": {
            "type": "string"
        },
        "quantity_pending": {
            "type": "number"
        },
        "quantity_sold": {
            "type": "number"
        },
        "quantity_total": {
            "type": "number"
        },
        "capacity_pending": {
            "type": "number"
        },
        "capacity_sold": {
            "type": "number"
        },
        "capacity_total": {
            "type": "number"
        },
        "capacity_is_custom": {
            "type": "boolean"
        },
        "holds": {
            "type": "array"
        }
    },
    "meta": {
        "folder": "EventCapacities",
        "filename": "postEventCapacityTier",
        "resourceName": "Update",
        "transition": "Update a Capacity Tier",
        "transitionResponseTypes": {
            "200": "\\Eventbrite\\Model\\DataType\\CapacityTier",
            "400": "\\Eventbrite\\Model\\DataType\\Error",
            "403": "\\Eventbrite\\Model\\DataType\\Error",
            "404": "\\Eventbrite\\Model\\DataType\\Error"
        },
        "transaction": "httpTransaction",
        "messageType": "httpResponse",
        "resourceGroupName": "EventCapacities",
        "resourceGroup": "\\Eventbrite\\Resource\\EventCapacities",
        "transactionMethodName": "postEventCapacityTier",
        "responseStatusCode": 200,
        "responseType": "\\Eventbrite\\Model\\DataType\\CapacityTier"
    }
}